,question,answer,category,table_id
573,How many Asia Cup games did Gagan Ajit Singh compete in?,2,hockey,486
574,At what age did Gagan Ajit Singh win a medal at the Asian Games?,22,hockey,486
575,How old was Gagan Ajit Singh when he began his senior career?,25,hockey,486
576,How many years after Gagan Ajit Singh began playing for the national team did he win a medal at Hobart?,4,hockey,486
577,How many cities did Gagan Ajit Singh medal at in 2001?,2,hockey,486
578,In what year did Singh win the most gold medals in international competition?,2001,hockey,486
579,How many years before Singh played for HC Klein Zwitserland did he play for the Indian national team?,8,hockey,486
580,How old was Singh when he won gold in the Asia Cup?,23,hockey,486
581,At what age did Gagan Ajit Singh win a medal at the Champions Challenge?,21,hockey,486
582,How many years did Dhyan Chand serve in the army?,34,hockey,524
583,Over how many years was Dhyan Chand on a senior career team?,4,hockey,524
584,How many gold medals did Dhyan Chand win in the Olympics?,3,hockey,524
585,How old was Dhyan Chand when he won his first gold medal at the 1928 Olympics?,23,hockey,524
586,How old was Dhyan Chand when he won his final gold medal at the 1936 Olympic Games?,31,hockey,524
587,How many gold medals did Dhyan Chand win while playing for British India?,3,hockey,524
588,How many years after Dhyan Chand's hockey career ended did his military career end?,7,hockey,524
589,How many years after Dhyan Chand joined the military did his hockey career begin?,4,hockey,524
590,How many gold medals did Dhyan Chand's hockey team win?,3,hockey,524
591,How many years did Sachin Tendulkar play for the national side?,24,cricket,526
592,How old was Sachin Tendulkar when he played his last one-day match?,39,cricket,526
593,How many ODI matches did Sachin Tendulkar play?,463,cricket,526
594,How long in years was Sachin Tendulkar a part of the national side?,24,cricket,526
595,How long in years was Sachin Tendulkar a member of parliament?,6,cricket,526
596,How long in years did Sachin Tendulkar play for Mumbai?,25,cricket,526
597,How many 10-wicket hauls does Sachin Tendulkar have in matches?,0,cricket,526
598,Who did Sachin Tendulkar play for in 1992?,Yorkshire,cricket,526
599,How old was Sachin Tendulkar when he joined team Mumbai?,15,cricket,526
600,How old was Bradman during his Test debut?,20,cricket,527
601,How many years after his last Test did Bradman die?,53,cricket,527
602,At what age did Don Bradman play his last Test?,40,cricket,527
603,How many years did Don Bradman play for the national side?,20,cricket,527
604,How old was Don Bradman when he made his first Test debut?,20,cricket,527
605,At what age did Don Bradman join his second domestic team?,27,cricket,527
606,How many years after Don Bradman's last Test was his death?,52,cricket,527
607,How old was Don Bradman when he made his international Test debut?,20,cricket,527
608,How old was Don Bradman during the year of his last international Test?,40,cricket,527
609,Which domestic team did Don Bradman play for when he turned 30?,South Australia,cricket,527
610,Which domestic team did Bradman play for during his Test debut?,New South Wales,cricket,527
611,At what age did Don Bradman play for the national side?,20,cricket,527
612,How old was Brian Lara when he first played for Team Trinidad and Tobago?,18,cricket,528
613,What year did Brian Lara join Team Transvaal?,1992,cricket,528
614,How many years after joining the international team did Brian Lara join the domestic Warwickshire team?,4,cricket,528
615,How old was Brian Lara when he joined the West Indies international team?,21,cricket,528
616,Against which country was Brian Lara's Test debut in 1990?,Pakistan,cricket,528
617,At what age did Brian Lara play his last ODI?,37,cricket,528
618,At what age did Brian Lara play for Southern Rocks?,41,cricket,528
619,How many years did Brian Lara play for Team Trinidad and Tobago?,21,cricket,528
620,How many domestic teams did Brian Lara play on in 1995?,2,cricket,528
621,What professional team was Eddy Merckx on when he won gold at the World Championships in Heerlen?,Peugeot–BP–Michelin,cycling,635
622,How old was Eddy Merckx when he joined his first professional team?,20,cycling,635
623,What was the color of the medal in all of Eddy Merckx's World Championship wins?,Gold,cycling,635
624,At what age did Eddy Merckx last win 34 individual stages at the Tour de France?,30,cycling,635
625,At what age did Eddy Merckx win gold at the 1964 World Championships?,19,cycling,635
626,What year did Eddy Merckx win his first gold at the World Championships?,1964,cycling,635
627,How old was Eddy Merckx when he started his professional career?,20,cycling,635
628,What year did Eddy Merckx go professional?,1965,cycling,635
629,How many years elapsed between Merckx's first General Classification win and his last Combination Classification win at the Tour de France?,5,cycling,635
630,What discipline did Jacques Anquetil participate in?,Road and track,cycling,636
631,What was the first professional team Jacques Anquetil joined?,La Perle,cycling,636
632,How many times did Jacques Anquetil participate in the stage race Paris-Nice?,5,cycling,636
633,How old was Jacques Anquetil when he began riding professionally?,19,cycling,636
634,What year did Jacques Anquetil begin riding professionally?,1953,cycling,636
635,What medal did Jacques Anquetil win at the 1952 Helsinki Olympics?,Bronze,cycling,636
636,What is the first word on Jacques Anquetil's shirt?,FORD,cycling,636
637,How old was Jacques Anquetil the year he medaled in Helsinki?,18,cycling,636
638,In how many cities did Jacques Anquetil medal?,2,cycling,636
639,How many years are between Jacques Anquetil's first and last medal wins?,14,cycling,636
640,How many years ago did Jacques Anquetil die?,35,cycling,636
641,Which professional team did Jacques Anquetil represent in 1968?,Bic–Hutchinson,cycling,636
642,At what age did Roger De Vlaeminck win the Vuelta a España in 1984?,37,cycling,637
643,How many medals did Roger De Vlaeminck win in World Championships starting in 1974?,1,cycling,637
644,What year did Roger De Vlaeminck win the gold medal at the World Championships?,1975,cycling,637
645,How old was Roger De Vlaeminck when he won the Tour de France in 1970?,23,cycling,637
646,At what age did Roger De Vlaeminck win the Vuelta a España?,37,cycling,637
647,What team did Roger De Vlaeminck represent five years after leaving Dreher?,Brooklyn,cycling,637
648,At what age did Roger De Vlaeminck win his first World Championships gold medal?,28,cycling,637
649,Which professional team did Roger De Vlaeminck join in 1975?,Brooklyn,cycling,637
650,In which year did Roger De Vlaeminck win a silver medal in the World Championships?,1975,cycling,637
651,What medal did Chris Ciriello win in the 2014 World Cup?,Gold,hockey,670
652,What medal did Chris Ciriello win at the 2012 London Olympics?,Bronze,hockey,670
653,How old was Chris Ciriello when he married Heidi Ciriello?,25,hockey,670
654,During what year did Ciriello win the most overall gold medals?,2014,hockey,670
655,What team did Ciriello play for in the year he won the bronze at the London Olympics?,Punjab Warriors,hockey,670
656,How many times was Chris Ciriello married before he joined the Punjab Warriors?,1,hockey,670
657,How many Champions Trophies had Chris Ciriello won before winning an Olympic medal?,1,hockey,670
658,How many Commonwealth Games medals did Chris Ciriello win after winning an Olympic medal?,1,hockey,670
659,How old was Chris Ciriello during the 2012 London Olympics?,27,hockey,670
660,What was the last year Jorge Lombi won a gold medal at the Pan American Games?,2007,hockey,680
661,How old was Lombi when he won gold at the Pan American Games?,24,hockey,680
662,In what year did Lombi win the most gold medals?,2007,hockey,680
663,How many years were between Lombi'''s gold medals in Alexandria and Mar del Plata?,10,hockey,680
664,How many gold medals did Jorge Lombi win in 2007?,2,hockey,680
665,How old was Jorge Lombi when he won a Champions Challenge bronze medal?,30,hockey,680
666,How old was Jorge Lombi when he won at the 1995 Pan American Games?,24,hockey,680
667,In what year did Jorge Lombi win a silver medal at the Pan American Games?,1999,hockey,680
668,How many more Pan American Games gold medals does Jorge Lombi have than Champions Challenge gold medals?,1,hockey,680
669,How many gold medals has Luke Doerner earned?,7,hockey,686
670,How many medals did Luke Doerner win in 2008?,2,hockey,686
671,In what year was his first medal?,2005,hockey,686
672,In which year did Luke Doerner compete in the Olympic Games?,2008,hockey,686
673,How many gold medals has Luke Doerner earned in Melbourne?,2,hockey,686
674,What year did Luke Doerner win gold at the World Cup?,2010,hockey,686
675,How many medals did Luke Doerner win in 2010?,2,hockey,686
676,Where did Luke Doerner win a gold medal at the 2006 Commonwealth Games?,Melborne,hockey,686
677,How many more silver medals than bronze has Luke Doerner earned?,1,hockey,686
678,How many years after the operation of Fatah ended did Iraq remain an ally?,5,terrorist orgnization,711
679,Which country was an opponent during the time period of Fatah – The Revolutionary Council?,Israel,terrorist orgnization,711
680,Over how many years was Iraq an ally of Fatah – The Revolutionary Council?,17,terrorist orgnization,711
681,Who were the allies of Fatah – The Revolutionary Council in two separate time periods?,Iraq,terrorist orgnization,711
682,How many years after the operation of Fatah began did Syria become an ally?,5,terrorist orgnization,711
683,How much longer in years was Iraq an ally than Libya during the '70s?,4,terrorist orgnization,711
684,How many years ago did the Liberation Tigers of Tamil Eelam start?,46,terrorist orgnization,712
685,How many years ago were the Liberation Tigers of Tamil Eelam defeated?,13,terrorist orgnization,712
686,How many years were the Liberation Tigers of Tamil Eelam active in Sri Lanka?,33,terrorist orgnization,712
687,How many years after the Islamic Republican Party was formed was it dissolved?,8,political party,930
688,How many years after the Islamic Republican Party was formed did it become part of the Grand Coalition?,1,political party,930
689,How many coalitions was the Islamic Republican Party a part of in 1979?,1,political party,930
690,What was the national affiliation the year the party was founded?,Islamic Coalition,political party,930
691,How many days after the Islamic Republican Party was dissolved?,3026,political party,930
692,How many years after the Islamic Republican Party was founded did the Grand Coalition become the national affiliation?,1,political party,930
693,How many years after the Islamic Coalition was the party dissolved?,8,political party,930
694,How many years ago was the Islamic Republican Party founded?,43,political party,930
695,How many years after the Islamic Republican Party was founded was the Grand Coalition the national affiliation?,1,political party,930
696,How many years ago was the Indian National Congress established?,136,political party,931
697,How many states and union territories were not governed by the Indian National Congress in 2022?,26,political party,931
698,How many total seats did the Indian National Congress have in the Lok Sabha and Rajya Sabha in 2022?,89,political party,931
699,How many seats do the Rajya Sabha and Lok Sabha have combined in 2022?,89,political party,931
700,How many years ago was the Indian National Congress founded?,137,political party,931
701,How many ideologies were there in the Indian National Congress in 2022?,4,political party,931
702,How many years after being founded as Birlik was the political party founded as Ada?,7,political party,932
703,How many years was there between the founding of Birlik and the dissolution of Adal?,9,political party,932
704,How many years had Adal been known as Birlik before it changed its name in 2020?,7,political party,932
705,How many years after its initial founding as Birlik was Adal dissolved?,9,political party,932
706,How many years after being refounded was it dissolved?,2,political party,932
707,What was the original name of Adal when it was founded in 2013?,Birlik,political party,932
708,How long in months did it last as Adal?,17,political party,932
709,What name was Adal known by in 2017?,Birlik,political party,932
710,Who was the Chairman of Adal before April of 2022?,Serik Sultangali,political party,932
711,How many years old was the Communist Party of the Soviet Union when it had over 19 million members?,71,political party,933
712,How many years old was the Communist Party of the Soviet Union when it became affiliated with Comintern?,1,political party,933
713,How many years old was the Communist Party of the Soviet Union when it stopped being affiliated with Cominform?,38,political party,933
714,On what date was the Communist Party of the Soviet Union founded?,"March 8, 2018",political party,933
715,What was the international affiliation the year after the party was founded?,Comintern,political party,933
716,How much longer in years was Bloc of Communists and Non-Partisans the national affiliation than Cominform was the international affiliation?,45,political party,933
717,On what date did the Communist Party of the Soviet Union end?,"November 6, 1991",political party,933
718,How many members did the Young Pioneers have in 1989?,19487822,political party,933
719,How many years after the party was founded did Bloc of Communists and Non-Partisans become the national affiliation?,18,political party,933
720,Who founded the Communist Party of the Soviet Union in 1918?,Vladimir Lenin,political party,933
721,How many years ago was the Communist Party of the Soviet Union banned?,31,political party,933
722,How many years was the Comintern organization in Russia?,24,political party,933
723,How many days after forming did it take for Hurricane Gaston to dissipate?,7,cyclone,957
724,Over how many months did Hurricane Gaston exist?,2,cyclone,957
725,For how many days was Hurricane Gaston over the water?,3,cyclone,957
726,After what date was Hurricane Gaston on land?,"August 29, 2004",cyclone,957
727,What year did Hurricane Gaston form?,2004,cyclone,957
728,What hurricane season did Hurricane Gaston form?,2004,cyclone,957
729,How many days did Hurricane Ivan last as a storm?,23,cyclone,958
730,Did the lowest pressure occur during September 2004?,yes,cyclone,958
731,How many months ago did Hurricane Ivan exist?,219,cyclone,958
732,How many days after formation did Hurricane Ivan reach peak intensity?,11,cyclone,958
733,Was the United States affected by the hurricane?,yes,cyclone,958
734,What was the cost of the hurricane damage in dollars?,26.1 billion,cyclone,958
735,Which year did the hurricane start?,2004,cyclone,958
736,How many areas did Ivan hit on its path?,11,cyclone,958
737,How many people died from causes related to Ivan?,124,cyclone,958
738,What category was Hurricane Ivan?,5,cyclone,958
739,On which date did Hurricane Ivan reach peak intensity in the Yucatán Channel?,"September 13, 2004",cyclone,958
740,What category was Hurricane Ivan?,5,cyclone,958
741,How many years did the Second Liberation Army exist?,8,proxy war,974
742,How many years did the Chadian Civil War last?,14,proxy war,974
743,How many years had the Chadian Civil War been ongoing when François Tombalbaye was overthrown and killed in 1975?,10,proxy war,974
744,How many years had the Chadian Civil War been ongoing when Félix Malloum was overthrown in 1979?,14,proxy war,974
745,How many years did the Chadian Civil War last?,14,proxy war,974
746,Who were the belligerents in the Chadian Civil War in 1970?,Second Liberation Army,proxy war,974
747,Who was the leader of Libya in 1971 when supporting the Chadian Civil War?,Muammar al-Gaddafi,proxy war,974
748,How many years did the civil war in Chad last?,14,proxy war,974
749,How many years before the end of the war was the Third Liberation Army formed?,11,proxy war,974
750,How many years longer was GUNT part of the Pro-Libyan Chadian faction than Codos?,4,proxy war,975
751,How many years before the end of the war did DR Sudan end its support?,2,proxy war,975
752,How many years after FAT was GUNT an Anti-Libyan Chadian faction?,7,proxy war,975
753,How many years was Codos involved in the Chadian-Libyan conflict?,3,proxy war,975
754,Which belligerent was part of the Anti-Libyan Chadian faction for the longest time?,FAN,proxy war,975
755,How many years did DR Sudan support the Chadian–Libyan conflict?,7,proxy war,975
756,How many years before the war ended did the Republic of the Congo stop being a belligerent?,2,proxy war,978
757,How many years longer was Katanga a belligerent than Kwilu and Simba rebels?,2,proxy war,978
758,How many years after the start of the war did the United States become a belligerent?,4,proxy war,978
759,How many years longer was the command of Abdul Salam Arif than Abdul Rahman Arif's?,1,proxy war,981
760,How many years after the beginning the war did the Soviet Union end its non-combat aid?,3,proxy war,981
761,How many years before the war began did Abdul Karim Qasim become a leader?,3,proxy war,981
762,Who was the longest tenured leader or commander of Ba'athist Iraq?,Abdul salam Arif,proxy war,981
763,Who was the first commander of KDP after 1964?,Ali Askari,proxy war,981
764,Who was the commander of the First Kurdish–Iraqi War in 1960?,Abdul Karim Qasim,proxy war,981
765,How many Iraqi soldiers were killed in the First Kurdish–Iraqi War held between 1961-1970?,10000,proxy war,981
766,How many years was Ahmed Hassan al-Bakr a leader and commander of Ba'athist Iraq?,1,proxy war,981
767,Where was the First Kurdish–Iraqi War held in 1965?,Iraqi Kurdistan,proxy war,981
768,How many years did the First Sudanese Civil War last?,16,proxy war,982
769,How many years have passed since the First Sudanese Civil War ended?,50,proxy war,982
770,How many years before the war ended did the Republic of the Sudan stop being a belligerent?,3,proxy war,982
771,How many years after the beginning of the war did the Sudanese Armed Forces reach their greatest strength?,16,proxy war,982
772,What country became a belligerent the same year the Democratic Republic stopped?,Israel,proxy war,982
773,How many years has it been since the First Sudanese Civil War began?,67,proxy war,982
774,How many years longer was Neo Hom a belligerent than the Party of Democratic Kampuchea?,17,proxy war,987
775,How many years after the insurgency began did Russia cease being a belligerent?,14,proxy war,987
776,How long in years did the USA support the Insurgency in Laos starting from 1975?,15,proxy war,987
777,How many years has it been since the Insurgency in Laos?,47,proxy war,987
778,How many years did Neo Hom support belligerents in the Insurgency in Laos?,26,proxy war,987
779,What was the status of the Insurgency in Laos in 2020?,Hmong-led coup attempt against the Lao government foiled; alleged plotters tried and exonerated in the U.S.,proxy war,987
780,Did the US support belligerents during the Hmong-led coup attempt against the Lao government?,No,proxy war,987
781,How many years ago did the Insurgency in Laos start?,47,proxy war,987
782,How many years after the start of the insurgency did Vietnam begin its support for Laos?,1,proxy war,987
783,How many more years did the Malayan Emergency last after the independence of the Federation of Malaya?,3,proxy war,997
784,How many more years did Winston Churchill serve as a leader than Harold Macmillan?,1,proxy war,997
785,How many years before the end of the emergency did Southern Rhodesia cease being a belligerent?,7,proxy war,997
786,How many years after the Malayan Emergency began did Clement Attlee become a leader?,3,proxy war,997
787,Who was the President of the United States when the Malayan Emergency began?,Harry S. Truman,proxy war,997
788,Who was the Prime Minister of Great Britain when the Malayan Emergency ended?,Harold Macmillan,proxy war,997
789,How many leaders or commanders ended their role in the year the war ended?,2,proxy war,1000
790,How many more years was Arnaldo Schulz a leader or commander than Filipe Samuel Magaia?,2,proxy war,1000
791,How many years after the war started did Francisco da Costa Gomes become a leader or commander?,9,proxy war,1000
792,What was the strength of the Rhodesian police reservists during the last year of the war?,19000,proxy war,1001
793,How many years before the war ended did Southern Rhodesia cease being a belligerent?,14,proxy war,1001
794,How many more years was Rhodesia a belligerent than FROLIZI?,13,proxy war,1001
795,Which belligerent became involved the same year that the murder of Aldo Moro occurred?,Third Position,proxy war,1020
796,What was the second-to-last name of the far-left terrorists opposing the Italian government during the Years of Lead?,Worker's Power,proxy war,1020
797,How long in years did the Years of Lead last in Italy?,26,proxy war,1020
798,What event killed 85 people in 1980?,Bombing,proxy war,1020
799,How many far-right terrorist groups were active in 1975?,2,proxy war,1020
800,How many years had the New Order been fighting when the National Vanguard joined?,3,proxy war,1020
801,"Which came first, the collapse of popular support for the Red Brigades or the dismantling of the main far-right terrorist groups?",collapse of popular support for the Red Brigades,proxy war,1020
802,How many years after the Years of Lead began did the Bologna massacre occur?,12,proxy war,1020
803,How many years longer were the Red Brigades belligerents than the Workers' Autonomy?,12,proxy war,1020
804,On what date did the 1983 IBF World Championships end?,"May 8, 1983",sports event,1030
805,What was the start date of the 1983 IBF World Championships?,"May 2, 1983",sports event,1030
806,How many years after Copenhagen were the IBF World Championships in Calgary?,2,sports event,1030
807,How many years after Jakarta were the IBF World Championships in Copenhagen?,3,sports event,1030
808,Which country did the silver medalists Park Joo-bong and Lee Eun-ku represent in Men's doubles at the 1983 IBF World Championships?,South Korea,sports event,1030
809,Over how many days did the Men's doubles at the 1983 IBF World Championships last?,7,sports event,1030
810,Who won the gold medal in Men's doubles at the 1983 IBF World Championships?,"Steen Fladberg, Jesper Helledie",sports event,1030
811,Over how many days did the 1983 IBF World Championships take place?,7,sports event,1030
812,How many medals did the host country win in 1983?,1,sports event,1030
813,How many nations left without a medal from the 2016 FINA World Swimming Championships (25 m)?,44,sports event,1031
814,How many medal winners in the Women's 100 metre breaststroke at the 2016 FINA World Swimming Championships (25 m) came from the same country as another medal winner?,2,sports event,1031
815,"Given she swam 4 laps, what was the average number of seconds it took Alia Atkinson to swim a lap, rounded to the nearest integer?",16,sports event,1031
816,Who won the gold medal in women's 100 metre breaststroke at the 2016 FINA World Swimming Championships?,Alia Atkinson,sports event,1031
817,Where were the 2016 FINA World Swimming Championships held?,WFCU Centre,sports event,1031
818,"Over how many days did the heats, semifinals, and finals of the women's 100 metre breaststroke last at the 2016 FINA World Swimming Championships?",2,sports event,1031
819,What is the number of years between the previous and next FINA World Swimming Championships?,4,sports event,1031
820,How many days earlier was the heat from the final in the women's 100 metre breaststroke at the 2016 FINA World Swimming Championships?,1,sports event,1031
821,How many competitors participated in Women's 100 metre breaststroke at the 2016 FINA World Swimming Championships?,60,sports event,1031
822,How many days before the finals were the semifinals?,1,sports event,1032
823,How many days after the heats and semifinals did the finals occur?,1,sports event,1032
824,Which country did bronze medalist Sydney Pickrem represent in the 2019 World Aquatics Championships?,Canada,sports event,1032
825,How many more competitors were there than nations participating?,7,sports event,1032
826,How many days were there between the semifinals and finals at the 2019 World Aquatics Championships?,1,sports event,1032
827,Who won the gold medal in the Women's 200 metre breaststroke at the 2019 World Aquatics Championships?,Yuliya Yefimova,sports event,1032
828,How many medals did the host country win in the Women's 200 metre breaststroke at the 2019 World Aquatics Championships?,0,sports event,1032
829,On what date did the heats of the Women's 200 metre breaststroke take place at the 2019 World Aquatics Championships?,"July 25, 2019",sports event,1032
830,On what date did the finals of the Women's 200 metre breaststroke take place at the 2019 World Aquatics Championships?,"July 26, 2019",sports event,1032
831,"What country was the gold medalist from on July 26th, 2019?",Russia,sports event,1032
832,How many years before the 2019 World Aquatics Championships did the previous World Aquatics Championships occur?,2,sports event,1032
833,How many years after the 2019 event in South Korea did the World Aquatics Championships occur again?,3,sports event,1032
834,Over how many days did the 1995 Atlantic hurricane season last?,153,cyclone,1089
835,Did the 1995 Atlantic hurricane season average at least a hurricane per month?,yes,cyclone,1089
836,How many total storms formed during the 1995 Atlantic hurricane season?,19,cyclone,1089
837,What month did the first storm system form during the 1995 Atlantic hurricane season?,June,cyclone,1089
838,How many hurricanes formed during the 1995 Atlantic hurricane season?,11,cyclone,1089
